{"cases":[],"changes":[],"comparisons":[],"completeness":{"limitations":[],"values":{"artifact-coverage":"complete","state-capture":"complete"}},"diagnostics":[],"evaluations":[],"evidence":[],"facts":[],"investigation_id":"investigation:3562557dbaf8d2fd544dee335b4f9d771dd5c250c12545d0d2b6c31c3a8fc42d","manifest":{"budgets":{"bytes":4096},"capability_identity":"capability:fixture","configuration_identity":"configuration:fixture","native_schema_version":"1.0.0","producer_version":"0.0.0","repository_id":"repo:fixture","state_ids":["state:4c49cc4a85a61bf98f9b2b433f88f986433c2c20618d4accd4c3198e9878af24"]},"obligations":[],"schema":"https://gitdrift.dev/schemas/investigation/v1","schema_version":"1.0.0","snapshots":[{"content_identity":"sha256:readme","evidence_id":null,"id":"snapshot:dd950077ec0b241af7001b2d69b09a081893a3822282f30726755c96d1b17b00","mode":null,"path":"README.md","state_id":"state:4c49cc4a85a61bf98f9b2b433f88f986433c2c20618d4accd4c3198e9878af24"}],"states":[{"base_state_id":null,"content_identity":"commit:abc;tree:def","id":"state:4c49cc4a85a61bf98f9b2b433f88f986433c2c20618d4accd4c3198e9878af24","kind":"commit","limitations":[],"locators":[],"repository_id":"repo:fixture"}]}
